,cat,txt
273320,video_games,"I gotta say, Nintendo knocked it out of the park by getting games like this lined up to fill the gap between Zelda and Mario "
1998610,science_and_technology,"What precious thing did you want to post that you can't?

"
1672460,sports,"Freeney sack@!

Good job old timer!!"
1328589,sports,Don't blow it....keep it simple.... count your money 
650904,video_games,Which platform? When? Can't play till Friday probably. Even if I have the freaking season pass :(
2104799,news,"Looks like trump is going to have to redefine ""Betrayal""

*typing on phone sux"
2081571,news,[removed]
596713,video_games,Think akin was the word you were going for!
864433,video_games,Kubo bombed in theaters 
1250883,sports,MELOOOOOOoooooooo
932438,sports,"I remember someone mentioned that the last time a team went on an 8 game home streak of 5+ goals* was the Pens in 92, any way to know when the last time a team did 9 was?

*Which is a very narrow superlative."
476484,video_games,[removed]
117892,video_games,"I believe this took effect with ""The Dawning"" patch so you're a little late on this one. The shaders do look great on different classes for sure!"
1178350,sports,...he's not?!?!?!
1744403,video_games,The face when.
413551,video_games,"Yes, you will most likely want your Switch set to full RGB then :)"
556777,video_games,Dat overwhelming tension when it seemed like you were gonna fall
2248913,news," No it wouldn't. They're still ridding themselves of undesired genetic material. Adolf's wet-dream. Especially when it comes to lower socio-economic elements. And 3% where? Do you even realize that 3% is a huge number in this context? That's about the same number of children born with birth defects in the US. How common do you think genetic disorders are? In 2012 an American study found the 70% of the woman that had a positive Downs syndrome diagnosis choose (selected) to have an abortion. That's pure eugenics whether you like it or not. Just own in for what it is. Why do you need to hide behind semantics? Is it it so important to be the good guy? And how is it less worse to terminate (kill) a fully healthy fetus? 
 
And sex-selective abortion are already common, especially in China. And when prenatal genetic tests become more common, detailed and less stigmatized we can finally have the eugenics program the Nazis could only dream of! "
610388,video_games,[removed]
252559,sports,Elite 3 
1572579,news,"This pretty much right here. Rednecks didn't vote for Trump, hell most rednecks probably didn't vote at all. "
240812,sports,Rui Patricio
1712500,sports,"&gt; Why people think this means the end of the cousins redskins saga I have no idea

Because this is /r/NFL, and the drama queens that populate it love them some lolRedskinscirclejerking."
1558507,news,"Oh, I know.  Sometimes, though, you just wanna wrestle with trolls."
992873,sports,Jets got a bonus goal for not being the Habs
1576376,news,"Googling this directly contradicts your comment, with numerous sources corroborating that.

There are quite a few ""medical"" reasons to do it. I googled them in 10 seconds. Surprising you haven't when you're so hostile.

Instead of calling people ""fucking retards,"" maybe you should understand what you're perpetuating as fact, and/or improve your literacy.

"
109432,sports,Not that I've heard 
1552403,news,[deleted]
1564300,news,"""It's not illegal if the president does it."""
2255613,news,i just don't agree with you i guess
816429,sports,[deleted]
2235601,news,"Yep, got me. I'm a dirty commie. "
293481,video_games,[removed]
2022177,science_and_technology,"Wasn't this made obvious offer Correcting The Record started brigading, reporting, and manipulating any reddit post that put a negative light on Hillary Clinton? "
1558335,news,"""Game over, man!""

PVT. Hudson (AKA Bill Paxton, Aliens)

RIP dude."
971286,sports,"""After careful consideration, the DOPS believes that the delimbing was a result of incidental contact, and therefore a good hockey play."" "
1887047,sports,"Schmeichel found his form, too. Incredible. "
492074,video_games,They could not craft their own language but this one dude in a hard had almost realized he was in a digital game world. He didn't even care. Some say he still wanders the streets of the old liberty city to this day
625540,video_games,"All good there, it's fun and makes it easy. Just too bad there has been no easy connection fix, or to at least save/bring them back in.  "
2270413,video_games,"Intros are kind of outdated, I would suggest to get rid of the intro, I wanna see Jerry (the dragon) sooner rather than later!"
490186,video_games,"Appendectomy, easily."
1388323,sports,2spooky4me 
2072086,news,Because SM-3's can't blow up land targets or deliver nukes.  Its not defined as part of the INF treaty.
919968,sports,Because Jets fans would be all over a Kane thread.
761964,video_games,"I am a rather new player, and I had quite a few times the *very* frustrating experience that I was stuck because I simply wasn't given any knowledge about how to handle some seemingly invulnerable enemies.     
Something about the game design is really wrong if your new player have to abandon a mission and visit the wiki just to find out how to damage a rather common enemy."
2051449,video_games,where can we see live status network from respawn?? or news about this 
1135040,video_games,"Your post has been removed because feature suggestions must be at least 250 characters in length per the [Feature Suggestion rule](https://reddit.com/r/leagueoflegends/wiki/subredditrules#wiki_feature_suggestions).

*I am a bot, and this action was performed automatically. Please [contact the moderators of this subreddit](/message/compose/?to=/r/leagueoflegends) if you have any questions or concerns.*"
440939,video_games,Definitely Leo. Look at that part. 
123521,video_games,"A sentient star, or a family of sentient stars."
988394,sports,Yeah be a little bit more salty won't you. OP being a crybaby
1377187,sports,[deleted]
1958371,science_and_technology,"Every NASA mission going forward requires SLS, whether or not SLS actually launches the mission.  If not for SLS, then NASA won't be able to petition congress to fund any other missions.  The whole point of SLS is to maintain the facilities across 35 states.  It's not about cost or efficiency at all."
1773689,video_games,You missed the opportunity for eggclusive 
1263402,sports,Obv.  It's a Saturday.
439313,video_games,"About the GameStop pay at 9, buy it at midnight thing. Can I pay at 9 then pick it up the next day?"
1433247,news,Libertarians are all for leaving matters to be taken care of via privatization. Why would they oppose her views?
1071797,video_games,"Mental block most likely, let's just hope this year they regain the confidence needed to play at their level on the international stage."
469662,video_games,Ah thanks. That info is not on the NA site at all.
1959243,science_and_technology,Would 1.3 seconds be enough to expose the starfield like that?  Most ISS pics I've seen have space as black.  
1616558,sports,"That's not really an exception, that's the rule. The exception is office jobs that test for that."
1058765,video_games,"Dont listen to all these trolls, URGOD is the way to go bud !"
1362900,sports,"Seriously, what an awful offer."
1378016,sports,"Don't all sprinters forefoot strike? It's the most efficient way to run, with the toes and not with the heels."
1901571,sports,"Doesnt mean anything, look at Uruguay. "
1092920,video_games,If EU wants to stay the 2nd best region they should win this but it won't be easy.
2236510,news,"What's with the constant comparisons with Trump? Schulz and Trump are nothing alike. The main factor about Trump was that he had never been elected before and was an outsider. Schulz was a member of the European Parliament for 23 years, leading his parliamentary group for eight years, and was President of the Parliament for the past five. Before all that he was a local mayor. Schulz is a very skilled and successful politician already."
266090,sports,I've been thinking about introducing them to each other. But what if I end up third wheeling? 
1400193,news,"For what it's worth, the drone program under Obama has pissed me off, though not quite as much. It's horrible, but I do value our service members lives more than potential collateral damage of people who, there is a high chance, considers us their enemy. 

I still didn't like some of the targeting parameters. It seemed too loosey goosey. But at least American lives weren't at risk. 

The thing is, I don't think that's going to happen. People aren't going to open their eyes to the blatant militarism in our country. There are too many people who think every international problem is a nail and our military is the hammer. 

And with something like this? It turns into a 'well we did what we had to do' Vs. 'we can't ever kill civilians' argument instead of a 'should we be there' vs 'should we not be there' argument, which is what we SHOULD be having.
"
647708,video_games,It is indeed. I'm getting filled with these same clips all over the first pages of this subreddit. Glad I got to know how filtering worked.
1595301,news,"&gt; There isn't a time in their history when they haven't been stomping on individuals civil rights. From harassing MLK, to blatant entrapment cases, warrantless wiretaps and searches, overreaching with the patriot act, stirring up peaceful protests, planting backdoors and then convincing people to hack them, surveilling and harrassing peaceful protesters. 

They also broke the backs of the Mafia, the KKK, and countless other criminal/terrorist outfits. "
1751619,video_games,I am always dumbfounded with the line up they chose for me. Why would I send my Ryhdon out against the first two vaporeans and then a garados?
1046373,video_games,"well meddler has never been a smart one, all of the guys that works at riot with balance is fucking clueless."
2131128,news,"No it's not, there is no credible source."
2182571,news,"This is such a bullshit narrative, he was impeached for lying under oath in a sexual harrasment hearing....

Let's not act like he was just impeached for lying about a bj"
2295456,video_games,Seriously who still uses vent? 
434356,video_games,Looks like the Nintendo Switch is joining the PC mustard race. 
158656,video_games,"r/FlashTV is literal cancer.  And even then, not even half as bad as r/Arrow"
75789,video_games,"Interesting.  I have been debating getting my baby dragon to 5 or working on getting my golem to 6.  This was interesting to read, although i still am not sure what I am going to do yet.

im 13/20 on the baby d to 5...so I'm thinking finish that off, then work on the golem again.  I also use lightning regularly, and its at 14/20 to 5...

oh the choices!!

thanks for the post."
345611,video_games,So Butler and Julio and call it good for now? 
1371315,sports,Derrick Rose can earn a max contract (17.6 ppg this season) and he CAN return to his elite playing level with a good coach.
269902,sports,Sell when ea put his price range up bro you'll make bank 
2130634,news,"I'm not trying to say rape is acceptable nor that everyone should go off a free man. I just want to point out that when looking at a durable solution for a society in such a bad shape blindly punishing all perpetrators is rarely an effective solution. 

Reconciliation and rehabilitation are the only ways these types of conflicts end (See Rwanda and South Africa). 

You have to look at the situation. Being a combatant isn't as much a choice or a position of status but often a way of survival. You have soldiers who haven't been part of society, a family structure and who are deeply traumatised often fighting since their early teens. 
"
271059,sports,"For what it's worth, that's exactly what people said about IF Kante. He went down right away and then ended up settling around 420k for a few days before slowly dropping and now is closer to 350K. There definitely could be room for this card to go up, it just depends on what happens with packs this weekend more than anything else.

I ended up packing him and was debating on selling and buying later or not expecting to make some profit, but in all likelihood, he's going to end up costing 250-280 and if you want to use the card keep it. (in his case, selling was definitely the right card)"
380648,video_games,[I've also found my case](https://puu.sh/u3xha/b57cb74b53.png) 
557622,video_games,she cant block hooks directly but she can stop the hook shoot melee combo with defense matrix and her boost making the hook a useless.
1277390,sports,He might be using Mike's secret stuff.
1035639,video_games,"So he's going full on reverse Billyboss, as in not using TP to avoid making terrible LEP-tier TPs, like Billy's infamous short hop TP!"
1234792,sports,Kobe
1118766,video_games,He was raging about that in the call it was so funny 
128988,video_games,"OP, I am with you.
This patch sucks because it killed the double tactics that only a primary+special can give.
It is sad to see the game impoverished.
I always used snipers (my Loadouts is composed by 10 snipers), I don't like fusions and shotgun.. but what they did is terrible.
No specials at all.
It gave a nice feeling only at the beginning: no more shotgun around...
Then the bitter awareness...
"
2125964,news,"I knew about nestle and it is a really easy company to avoid, what about shell though? They've got the world over a barrel and can destroy what they please without consequence. I can't stop buying petrol or I can't get to work whatsoever. Renewable energy sources need to overtake fossil fuels soon."
605194,video_games,"Awesome, thanks for the info! I might pick it up tonight since there's a special perk for those who purchase by Feb 7!"
1253581,sports,"He retired in 2006, but he's just not that accomplished. He should still get in however"
860139,video_games,"I thought it'd be cool if the Blue Eye Orb worked like in DS1 and was the Darkmoon Item, where as the Blue Sentinels worked the way they do. They could still share items, as they would both hunt invaders, but it would make them a little different at least."
1364395,sports,Fucking bullshit call. There are bad calls and then there's that piece of shit
1053344,video_games,"He definitely has a history of being toxic, but I'm really not sure if he's genuinely toxic or salty. Streamers nowadays are caricatures of they're most noticeable trait. QT has his whole chill stream shebang, NB3 is his overdramatic self, IWD is a salty flamer. "
1252941,sports,"Honestly, one of the most interesting things about the Warriors next offseason is that KD and Steph are both going to be free agents. KD's prolly gonna opt out to get in on a salary cap thats set to go up quite a bit iirc. Meanwhile, Steph needs to get his max. 

There could be a ton of changes coming to Golden State's roster this offseason. "
1924069,sports,I'd lose control of my bodily functions if Big Vic wanted to fight me.
71037,video_games,"They're risky and ineffective to use in a combo in an offensive push because they just get Logged and that will kill them AND delay and damage the troop you used with them. I think they're pretty decent on defense because they can't be Zapped, but then Executioner came along and had to ruin the party. "
700829,video_games,"this was in the google research, just gives me a black screen, can hear the game but need to crtl enter to get picture back"
1968985,science_and_technology,Companies pre-announce press conferences all the time. How exactly do you think the press knows to show up? 
1802830,science_and_technology,"""I got food, I am wanted."""
329129,sports,"If that's the case why didn't he sign any new players? I'm baffled at how much this sub is defending him.

"
1822130,video_games,me too thanks
147355,video_games,What's the cost to buy glass needles again? A shard is involved in that though right? 
145802,video_games,The Full-Auto spread penalty was removed in the last balance patch for all shotguns except Invective.
440142,video_games,"I literally say in my OP that apple overcharges for their products and I take that into account.... 

&gt;If you look around this thread you will see a lot of cheaper options.

I've posted most of those myself, and pointed out why the ones posted by others are not equivalent options. 

&gt;If you compare Nintendo with anything it's other gaming consoles

Why would I compare a usb-c adapter to a gaming console...?"
1847715,sports,HOW DO YOU HAVE 3 OPPORTUNITIES TO SHOOT FOLLOWING A PENALTY
1964527,science_and_technology,How do you live next to a billionaire and not be a billionaire yourself??
922885,sports,"MB runs a tight ship, there was nothing solid to go on until the announcement "
461045,video_games,"Hey there!

Thanks for your post, but we are removing it because your image met one of the following criteria:

* The image you shared was considered low-effort as it did not contribute anything new or substantial to the community.

* The image lacked sufficient explanation/discussion to stand alone - Example: Instead of submitting box art of an old game with a title like ""Who wants to see this on the Switch?"", make a discussion post explaining what you would like to see from a game in that series, what inspirations you would like it to take, etc.

* The image was poorly made (Microsoft Paint, etc)

Thanks for your understanding!



---

If you have questions or objections about this removal, please [reach out to us in modmail](https://www.reddit.com/message/compose?to=%2Fr%2FNintendoSwitch)."
2023010,science_and_technology,This guy is seriously trying to say that memes on reddit and 4chan swung the election enough to give Trump a win? I think that's wildly overstating the popularity or relevance of the sites.
1964290,science_and_technology,He told you how to find it...
2270913,video_games,Agreed. MoP felt like Vanilla for a bit without the stupid red vs. blue dominating the storyline. The game felt like it was about exploring a strange new land.
224348,sports,[removed]
740417,video_games,"Amaterasu is my main because I'm a huge Okami fan, and she was my best character in ultimate marvel vs capcom. I love her human form and wish she had a wolf transformation. Wound't want to steal fenrir and skadi's swag though."
1281898,sports,"obviously i'm just going by what people told me, no scientific evidence here, and everyone is different -- but it seems like once you're over that 6'2""-6'3"" region, long rides in cars and airplane seats are really uncomfortable, chairs in auditoriums can be smaller, etc. 

USA average height i think is 5'10, so that's ideally what people build for. if you head out to asia, they are building for an average size of 5'6"". geography definitely has influence on these type of things"
1514831,news,Nope. See above.
1029022,sports,"He's an older lacrosse coach who's only kid and personally has never played the game, so he holds a lot of lacrossy opinions on the game. He also just loves making fun of things and people "
301795,video_games,"Its not flawless for sure, but ME3 is still a fantastic game. "
1228277,sports,Oh shiz these are very good points!
1526803,news,[deleted]
861380,video_games,"Dis
You're right  "
1133029,video_games,[Indeed](http://i.imgur.com/P7pxyJH)   
843673,video_games,Apparently you can also kill them with the gas mask by getting really close and taking it on and off repeatedly
1933363,sports,"Really? 

Reina barely touch the ball and then barrel into Cuadrado impeding his progress. How is that not a penalty?"
2062533,news,"Please, transmission fluid is supposed to be dark brown and have metal shavings in it.

At least mine does."
1998180,science_and_technology,logstalgia!
1624088,sports,Correcting him only makes you look more saltiness
955458,sports,"Much better than losing, surprised we didn't try this earlier!"
1474033,news,"You heard it here first.  Legal immigrants and illegal immigrants ""are the same"" because this guy says so."
2135673,news,Her in charge would definitely improve Trumps relation with us. 
2054331,video_games,"PC here, nope."
1275657,sports,THIS IS AMAZING!!!!
898436,video_games,This post made me feel good and sad at the same time...
388369,video_games,You too! Congrats!
1509612,news,"Correct but again we know this happens. We didn't need that example and we certainly didn't need to know what her kid's ethnic backgrounds were. 
"
1190063,sports,"Mark Medina...local guy...seems to have some inside info, but I don't think he's ever broken a news story. Hard to get with the new regime though."
1954189,science_and_technology,"You mean Hydraulic fluid to run the actuators (it's an open system; to save weight on valves and pumps and reservoirs they just load up extra fluid and let it squirt out the other side; underestimate the need for control actions and your actuators starve).

Unless you're talking about one I'm not remembering."
1581057,news,"China's ICBMs have ~5 Mt warheads.  
We've set off plenty of those.  "
531943,video_games,Reminds me of [this](http://www.trumpisnotateamplayer.com/).
429567,video_games,both!! (fingers and toes crossed)
1021364,sports,I'm sorry you feel that way. 
1491843,news,"Alex Jones was right, only it's not Obama targeting white southern republicans anymore. Trump's at the helm now and he's making good on his promise to take California down."
2252119,news,"Damn, these savages."
1028576,sports,"I feel you, bro. I feel you."
1385089,sports,"Hahahaha. What? I guess it makes sense because it should allow Harden to play less minutes, but that is not where I was expecting. "
1661537,sports,search Delonte West lol
851125,video_games,Idiots think everybody's camping. Or glitching. Or has a mother who needs to be insulted. The are a lot of bellends gaming the real shame is they are often the loudest ones.
190474,video_games,This needs more upvotes lmao
1878700,sports,Just gotta hold on then win 3-0 at home ez
2269014,video_games,"I think the opener is more fluid than that though -- it comes down to knowing the fights with experience and knowing when you should pre-SK (if that means you'd get an extra Stormkeeper squeezed in to the fight length) and also taking advantage of mechanics for Ascendance windows, like holding off on Ascendance until after you've finished the first rings set and have gotten the speed buff on Elis and have a 15 second window to turret her.

For example, on Krosus, I always run my opener like this:  
* -4s - Stormkeeper  
* -3s - Fire Ele  
* -2s - Pot  
* -1s - Elemental Blast  
* -0s - Flame Shock  
* 2x LvB  
* LBx3, using any Surge procs between and re-applying FlS with Elemental Focus  
* Elemental Blast  
* Ascendance + Racials, spamming Lava Burst and not Earth Shocking, only stopping the Meatballs to re-EB  

That way I also get to see if I'm going to get the first orb (which seems to happen every time I don't SK first and Ascendance on pull). But for fights like Gul'dan and Elisande, where there are good opportunities within the first 20-30 seconds to hit 3+ targets with SK-infused CLs, I hold off. 

That's also the opener that SimC gives me almost always regardless of fight lengths that I set. Just one perspective. 

Also, you didn't cast Chain Lightning once during Elisande. I'm not sure if your group wasn't stacking the boss on the adds when they were spawning, but unless you have POTM procs you should always CL on two+ targets (I'm usually bad and CL even with 2). That should be a nice DPS increase for you there alone -- at least 50k, since the DPS parsing above you all have multi-cleave damage as their highest sources of damage I'm assuming they were stacked and you were just ST'ing.

Try to take advantage of CL as often as possible -- it generates more Maelstrom than LB if it's hitting at least 2 targets and even more with the trait that increases the Overload chance, so it's always a better bet to CL to get to that 92+ Earth Shock quicker.

And yeah, the other thing is just to make sure you have a simple WA that lets you know when you're at or about to be Maelstrom capped. Make it yell at you. Since you are having a bit of trouble with Maelstrom management already, I would recommend running Lightning Rod or Ascendance build for the majority of NH fights, since Icefury is much more reliant on you being able to predict your Maelstrom 1-2 casts in advance for maximizing DPS. Once you're familiar with the fights and the basic rotation, that's when I'd say fuck around with Icefury on the dummies."
2046072,video_games,For sure. For me it's just in that rut of there are guns like it that perform better and more consistently and it doesn't have novelty to pick it over them like say the softball does. 
1393612,sports,"&gt; (to her face)

lol"
1682918,sports,Still only 1 SB with a HOF QB ðŸ˜‚ðŸ˜‚ðŸ˜‚
726522,video_games,Gabe might be the best NA team this year. Looking very strong and work so well together. Flashpoint is on the opposite end of the spectrum
2209952,news,"&gt; Actually yes; officially breasts are considered a fetish by definition.

Every sexual interest, including missionary, is a fetish by definition.


&gt; they are still overly sexualised by our culture in comparison to native tribes.

What native tribes, exactly? Because throughout human civilization, the majority have covered their breasts. The sexual interest in breasts predates the genus, so even the earliest humans liked the boobies. Whether it's categorically different from hips, butt, etc. is more murky but it's definitely sexual."
499682,video_games,"Wish ana would have said that for the halloween event
"
1089715,video_games,Lolalytics stats for Kassadin
812429,sports,Shit
657196,video_games,Thats why I would recommend a new harddrive for dedicated media
724304,video_games,This is a game with millions of players and you think a straw poll of a couple hundred votes matters?
1030411,sports,What do you mean?
