,cat,txt
882031,video_games,"If the game didn't happen in '87, that means we don't play as the Bite of 87 victim. We play as the Bite of _83_ victim. That wouldn't detest who we're playing as, according to MatPat's theory. When Scott made his comment, the very first few comments said that either we were the brother having the Nigtmares, or that the game was in 1983.

[See for yourself.](https://plus.google.com/106366690954360781333/posts/isfQmutM8Fm) "
1550516,news,"How exactly?  The EO was for 90 days.  You think SCOTUS hears this and issues a decision within 90 days, and that when they do one of the liberal justices is going to side with Trump?  Agree to disagree..."
1626563,sports,"qb* 

Typo"
151509,video_games,"Yeah, but it regenerates fast enough that you almost always have another bullet before you re-engage in PvP."
1780946,video_games,"What an amazing release!

Niantic if you're listening you should all feel super proud imo. All the refinements to the game / design / ui are 100. 

Kudos"
348735,video_games,Which Carr? 
1729185,sports,"Way to hold down the fort in this thread, man!"
855748,video_games,"Occasionally, if the leader isn't a particularly religious one, and they just spent their Great Prophet's last conversion, and your military is stronger than theirs, and they are friendly with you. I got Washington to stop once. Like, he actually moved missionaries out of my territory and started evangelizing in Greece.

I once got Pedro II to agree to stop proselytizing. I bought an inquisitor and missionary in two nearby cities. Two turns later my city was once again heresy-free. The next turn, Pedro reconverted my city. I rather enjoyed spreading the one true religion of Lebensraum to the people of Brazil in the turns following."
1518944,news,He didn't want to wrestle the girls.
1553975,news,Close enough?
30465,sports,And they still somehow made the natty. Even as a Husker fan I didn't believe it.
80156,video_games,ðŸ‘ðŸ¼
2256347,news,"common sense, or the wealthier, more educated have better doctors who think more freely rather than following the status quo?"
1176968,sports,"I love relishing in NYK's dysfunction as much as anybody, but the article title is kinda misleading. Lee said that the scraps and chippiness were good things, and that the team needed it."
984861,sports,they do at times 
1599777,sports,[deleted]
501170,video_games,"Thanks for the video, I think this just upped my Mystery Heroes game a little and I appreciate it."
1686591,sports,damn she's dancing with a ton of magicians
106266,sports,Calling this video shitty would be being too kind 
243507,sports,[removed]
1344499,sports,Brown man smacking his head 
1816629,video_games,I think you captured all of the captures. There's no more capturing left for any of us.
1995491,science_and_technology,I'm not too super surprised when I see a mom and pop shop on /r/computertechs complaining about GoDaddy issues. When I see it on /r/sysadmin I'm genuinely confused how these people are still using it.
1903978,sports,"&gt;""BvB Hurensohne"" thing

Explanation for those of us who don't know this?"
2158441,news,Why would someone want to immigrate from Japan? 
2014481,science_and_technology,"So, I'm not sure if anyone here remembers. But there is some history behind your exact question.

Back in the day /r/technology used to be a default. Not anymore. Why? Well back in the day when Tesla was first emerging, /r/technology was getting posts relating a lot more to tech and politics. They were important, they fit in /r/technology, but it seemed to take over the sub.

The mods at the time started to get really annoyed regarding so many posts about Tesla and politics at the time. There was some shit going down which had redditors up in arms. I think it had something to do with Republicans attacking Obama over the government loans he gave out to solar companies. 

So there was this huge debate going on in America and reddit wanted to showcase Tesla and its accomplishments as a reason to support the loans Obama gave.

Anyway, the mods made a stupid mistake of censoring Tesla entirely. So automod basically deleted every single mention of Tesla, its cars, its owner, its politics, etc.

Finally a redditor discovered this and posted about it. It was a huge controversy and eventually the admins stepped in. The mods stuck to their guns because they were tired of /r/technology not being about...well...gadgets. Back in the day /r/technology was a lot like /r/gadgets.

So the mods stuck to their guns, and the admins said ""fine, we don't agree with the direction you are taking this sub, so we can no longer keep you as a default subreddit""

The mods eventually did a number of things to try and be transparent and give users a choice, hence the pure tech filter. But it was too late. 

And ever since then /r/technology has been kind of....I don't know. An empty shell of what it used to be. Sure we get some active posts here and there. But the front page of /r/technology used to have hundreds if not thousands of posts on every post. 

Now there are tons of front page /r/technology posts which have 10-50 comments and that is it.

So anyway, there is your answer. There was a huge shit fit about this and it led to the fall of this subreddit."
2186880,news,"i mean, considering who we talking about, she probably wants to, but goes for the next best thing she thinks she could push through..."
430318,video_games,"I don't know, 3D World is a bigger 3D Land. 

3D Land is not so much a 3D Mario game. It's structured like a 2D Mario game, the mechanics is closer to a 2D Mario game, and the level design is also more akin to a 2D Mario game more than a 3D Mario game.

I'd call 3D World and 3D Land a hybrid rather than one or the other.

Like the NS, it's not a home console nor a handheld, it's both."
1597916,news,"Grab her pussy, of course. "
2201514,news,"she wasn't elected!

simple as

time for a GE"
1174203,sports,And his jumper was so smooth
731889,video_games,"I like:  

-Nox: Love her outfits and even for old masteries, the dress looks stunning on her. I love her combo and all around grabbing people and letting my teammates destroy them is extremely fun to do. She's my first ever rank X and I'll never put her down.

-Awilix: Love how she plays, and her personality is absolutely adorable. Pulling people through the ground with her ult is one of the most satisfying things ever (seriously if you haven't done it, try pulling a Scylla or Hades that's under the gruond) and it shocks the victim. 

-Amaterasu: If it wasn't already obvious by my flair, I love Ama to bits. She can be built kinda tanky and still do reliable damage throughout a match. Her Foxy skin is the only Kawaii skin I've seen so far that doesn't annoy me at all with any incessant moaning *cough*Bastet*cough* and she's just really fun to play. She's also my second rank X.

I hate:

-Hun Batz: Honestly almost everything about him annoys the fuck out of me. His leaping monkey thing just screams every ten seconds, everything about his ult is aggravating from the fear to the goddamn bongo drums, and almost every Batz player I've had the displeasure of facing spams his taunt/laugh/joke whatever it is that makes him just fucking howl like he's in heat.

-Freya: The only reason I hate Freya is her stupid gumballs. I would have rather had her damage reduced than whatever her latest nerf did. If the nerf was to her damage, do it again.

TL;DR

-I like Nox, Amaterasu, and Awilix

-I hate Hun Batz and Freya"
1639436,sports,"I really hope he just has a hype man walk around with him shouting ""PRIME TIME"" after everything he says.

I love Deion. "
385513,video_games,"Get there early, ask if the store will have extra consoles, and bring food and drinks, and prepare to be disappointed just in case you do not get the switch."
995505,sports,What???
1785781,science_and_technology,"Oh, I agree, but unless you can convince a non-technical manager of your organization the value in doing it, there probably won't be support to make big changes happen."
1125816,video_games,Thanks. Made me sad
584735,video_games,New achievement name: Did someone call tech support?
866077,video_games,Look at Gwynevere's comment.
48885,sports,Yeah I know. Best returning starter in the SEC as well.
187629,video_games,You can? I thought they got rid of the launch option to allow such mods
2171487,news,"oh yeah, absolutely; I was referring to both *myself* and *technology* maturing. :)"
1090084,video_games,Pls make one for lcs players now
1675222,sports,"Yup, then the Bills, then the Fish. Though the Bills are likely to move down now that Rex Ryan isn't their coach anymore."
1516446,news,"Hunger strikes are a very effective protest.

People get suspicious when a couple prisoners starve to death, reporters flood in when you have tens of men withering away like skeletons for all to see.

It tells people that clearly they are protesting something they believe strongly in, such as mistreatment or abuse, because why would someone starve themselves to that state for a frivolous cause.

Force feedings keep the inquiries away.

But as it is a painful, violent and dangerous method of torture, it may not be the best way to curb dissent.

Force feeding is bloodier than most assume.

The cartlige in your nose is crushed, the lining of your throat scraped and bruised, and fluid making its way into your lungs.

Force feedings are fucked and should be illegal.

"
2299471,video_games,"7/7M, 3/3M, 7/10M holy paladin here, happy to help answer questions

[Armory](http://us.battle.net/wow/en/character/drenden/Dyeus/advanced)

[Logs](https://www.warcraftlogs.com/rankings/character/21332457/latest#metric=hps)

*Sac is love. Sac is life.*"
1872173,sports,Who has the best away record?
1341559,sports,I'm surprised Myles Turner wasn't mentioned here. Didn't he alter his running mechanics too?
1837155,video_games,"And then he laughed. Not sure if about his mistake or the insanity that had just occurred.
"
1799167,science_and_technology,[removed]
1044485,video_games,"And you can zhonya without cancelling your ult with anivia as well, so its consistent."
1308702,sports,That's some Knicks fan talk right there man... it doesn't work.
1876275,sports,Well we all know what that means.
134840,video_games,"My PB/RF/SB hawksaw has always been a go to, and it will still be nasty. Was hoping the mid RoF pulses would get a buff. I have a beautiful Nirwens mercy, and it just sits, can't dismantle it the roll is that good."
620256,video_games,"The Wife and I have been saving to move to a new city, would love to use this code with the money in my digital wallet to buy a new game for us to play together while we hermit for a while.

Thanks in advance, you're kind for doing this!"
2321705,video_games,Mine came with fucking stickers
2253192,news,"Bernhard VII holds the record of almost 82 years. Just because the area that he ruled over no longer exists, it does not mean that his record is any less valid. "
68241,video_games,Supermeta bat overlevelled game supercell money royal giant furnace buttons 100k gold level 13
855639,video_games,"Japan can play tall, but it still benefits more from playing wide. You can do very well with a small number of cities, but you'd still have more output with an additional cluster of cities. 

The main difference with Japan is you need to have your cities clustered. A lone colony on a separate continent loses a lot of potential from not having neighboring cities. So as long as you spread your cities in groups, Japan is very good for playing wide."
621703,video_games,"&gt; Would have much preferred them to have put a little more into the base PS4 at start

Nope: Both ways they could've done that would've had a bad side-effect:

1. Release the PS4 on the same date (2013 November), but at a higher price.
2. Release the PS4 for the same price (399$), but at a later date.

If they'd charged more, sales would have been lower; but if they'd released the PS4 later, the XBox One would have gained huge popularity early on by being the only next-gen console available.

Overall, Sony made the right decision.
"
2164919,news,"Thanks. Le Pen is leading the first round polls by a couple of percent, but that's not too important in the French system. She will go through with one other candidate to the second round of voting, where everyone votes on the two candidates (likely to be Le Pen and Macron (centre left) or Hamon (socialist) at this stage). In the second round, all polls point to a 60-30 defeat for Le Pen by either candidate."
2151475,news,We bear the brunt of Mexico being shitty at controlling the monsters in their country.
461208,video_games,Yup and [Nintendo is not to blame](http://www.nintendo.com/consumer/wfc/en_na/ds/results.jsp?error_code=118-0515&amp;system=Wiiu&amp;locale=lang)
698939,video_games,"If it counted as a shot for the enemy it was a failed save, if it didn't count as a shot it was an own goal."
1980673,sports,"Food writter, not really gum shoe journalism"
2274668,video_games,"Can confirm, I got both turtles in the span of two hours in August of 2016 during the fishing frenzy. July there was no fishing frenzy going on due to there not yet being the changes that would precipitate it."
797899,science_and_technology,"I agree, but people should at least be aware of the correct terminology. I've had people try to correct me, saying ""that's not concrete, that's asphalt!"""
2223866,news,"thats exactly what happened in 2011

https://www.iaea.org/newscenter/pressreleases/source-iodine-131-europe-identified

&gt; The IAEA has received information from the Hungarian Atomic Energy Authority (HAEA) that the source of the iodine-131 (I-131) detected in Europe was most probably a release to the atmosphere from the Institute of Isotopes Ltd., Budapest. The Institute of Isotopes Ltd. produces radioisotopes for healthcare, research and industrial applications

no other radioactive isotopes were found, which we would expect in the case of a reactor or detonation, such as caesium-137"
156893,video_games,"My point is that Tusk isn't a standard offlane hero now and he would probably not play him if he was to play offlane now, which was the kind of hero the poster you replied to wanted to see Zai play with."
827220,sports,"1906 Cubs: Joe Tinker, Johnny Evers, Frank Chance, and Harry Steinfeldt.  Tinker, Evers, and Chance are in the Hall of Fame; Steinfeldt led the NL in hits that year and had a .327 batting average."
613073,video_games,[deleted]
561495,video_games,"But hey, he's the worlds first to get to top 500 in *this* season. It's a grand feat, all the same!"
1257880,sports,"On internet forums it means ""original post"" and has for so long that trying to change it now is dumb and just begs confusion."
2206853,news,".... from the comment this all spawned from.

&gt; TBH if a decade of wars and bombings in the middle east, causing mass homelessness, famine and refugee exoduses is STABILITY, I'm okay with seeing what instability would look like. Fuck it."
1682492,sports,"The playoffs are fun, you should try 'em."
2068140,news,Preferable even. YMMV.
2080296,news,"I'm not sure if it's required to, but my Dutch company provided the EU rates in those countries so far over the past few years. I can't believe they would have done it if nobody made them."
1250501,sports,"Trust me. You have nothing to worry about.

TRUST ME HAHAHA MCLEMORE"
1626317,sports,He died on my birthday last year :(
1461171,news,[deleted]
1563750,news,"They weren't convicted of identical charges, Torres was convicted of three counts of aggravated assault but not Norton."
726167,video_games,I believe Ama was Scott's design
1126875,video_games,he was pretty op for so long now hes a little bit weak.... you have to know that somethimes your champion will be op and somethimes weak that doesnt mean that he need a buff hes not even that weak 
2208597,news,[deleted]
665268,video_games,Ubisoft is always the reason
169231,video_games,"Yeah, you nailed it.  They don't do swipe texting.  - sent from my phone"
846883,video_games,I just want to finish my puzzles ;(
246246,sports,"Used to get gold 1 normally... But since I hate playing with a BPL team (The players are bad for me..They are the teams I like to play against the most) This WL, I'm aiming for silver 1, don't have the patience to tough a whole weekend with a BPL squad..."
1517963,news,"Truly. And I don't care what someone's packing in the restroom, so long as they aren't trying to peek over, under, or through the walls of the stall."
809361,sports,Having never watched before is WBC a best of? or just one match? Cause I could see us easily losing in a bo1 against some of Ace pitchers like Cueto.
979147,sports,"I mean... I observed all of that. The link between Windsor and Detroit is not lost on me. What I don't understand is how you can be ""from Windsor"" and a Canadian only since November. "
842430,video_games,ok! sounds good. I haven't played rush on bf1 yet (played a little on bf4) I have a couple of other people I play with too so hopefully we can all join together and fight the good fight together! I may not be on tonight but I'll be on Monday and Tuesday for sure
1146458,video_games,Cassiopeias ulty should have no effect on Lee sin. 
375495,video_games,"Oh I see what you mean now, straight below rather than diagonal?  

Didn't really think about that.  Curious to try it myself now.  I think for me personally it might actually be more comfortable, as I always felt like it was a bit uncomfortable to position your thumb the way it is on an Xbox right stick."
469598,video_games,They do
2126922,news,"Except it is on mainstream media and on TV. Also, people seem to be rather clueless about what this news really means. A lot of very unwarranted FUD."
741128,video_games,Shut your bitch ass up boy
1846524,sports,Liverpool seems to have kept a large fan base 
1579881,news,This is good advice.  I was just trying to give this guy something positive to think about though!
2339789,video_games,Not your place to repeatedly tell someone else how to play a game. I understand team composition but if you care that much switch to fill in the gap yourself. You don't have any grounds to complain imo. 
294123,video_games,"English isn't my forte, not native at all. What I meant is that every news about the price, if you look online, they say it will be 599$ because the Pro is 499$. It started with Spencer and then everyone is trying to get their estimate based on that. It would be suicide to price it at 600$, but even as of now, even us working in gaming, think it will be 599$. While not saying it's over the top above the PS4 Pro, it's currently the only console that can do 4K without a sweat.

But as a customer console gamer goes, does 4K gaming really that niche to explain an higher price than a Pro? Not really. I would take 1080p/60 before 4K/30."
156034,video_games,Cut me up small.. I'd do the same for you
1251732,sports,"Lol without Dennis we have literally no one who can handle the ball or get to the rim reliably. 

He's worth much more than 70 million right now. Try watching a game sometime instead of just regurgitating stats. "
1036676,video_games,Rip hai's kennen
580630,video_games,Damn it r/squaredcircle is leaking again. 
822366,sports,The fucking Giants.
611803,video_games,Seriously. My friend and I tried out Disc Jam during the beta and we were howling with laughter during the doubles matches. Simple but very well done game mechanics make this super addictive. It really is the 'Rocket League' for frisbee.
938441,sports,http://i.imgur.com/6kJmnfu.jpg
80028,video_games,also pekka will be faster than mortar :P
622743,video_games,"Does it not? If I'm going to be charged the same price for games of the same type and genre, why shouldn't I compare them to each other, even if one is obviously better than the other? If you don't set standards or raise the bar what's going to keep us from getting the same hot garbage over and over? 

Obviously you can't compare a game like the Witcher to something like Gungeon but I'd say the comparison stands when comparing games like this. "
2318451,video_games,[deleted]
546987,video_games,I had to have some kind of example of Character development. xD who knows what other hero's could become in the future. Maybe an evil Mercy :3 though this is all speculation.
1309772,sports,Inexperienced fans relying way too much on advanced stats for a developing 21 year old on a bad team
374506,video_games,"Me: Good time to disappear from the internet. 

Other me: I want all the spoilers.  All of them.  
"
2339105,video_games,I wasnt. I rarely play hanzo at all anyway. Just got him in the random hero mode and for whatever reason was just spot on with most of his shots.
972999,sports,White and Hanzal
235861,sports,Calculation on the App wasn't updated! Put your players in a squard on futbin and compare the overall! mostly they don't fit! 
1904858,sports,"This reminds me of Non-League Chips, a blog that reviewed chips at non league grounds, based on price, portion size, condiments and crispiness."
2063992,news,The Arab Spring did nothing to moderate religious beliefs. Don't confuse economic liberalization with secularism.
1329231,sports,"PG: 1. James Harden 2. Russell Westbrook 3. John Wall 4. Isaiah Thomas 5. Stephen Curry

SG: 1. DeMar Derozan 2. Klay Thompson 3. Bradley Beal 4. C.J. McCollum 5. Avery Bradley

SF: 1. LeBron James 2. Kawhi Leonard 3. Giannis Antetokounmpo 4. Kevin Durant 5. Paul George

PF: 1. Anthony Davis 2. Blake Griffin 3. Paul Millsap 4. Kevin Love 5. Draymond Green

C: 1. DeMarcus Cousins 2. Marc Gasol 3. Karl-Anthony Towns 4. Hassan Whiteside 5. Rudy Gobert"
1996785,science_and_technology,"For anything in the ""old and cheap enough"" range, /r/homelab is usually interested, and by extension, /r/homelabsales. 
Otherwise, eBay &amp; local selling sites"
142428,video_games,"&gt;I got Wrath of the Machine armour outside of the raid

Uh, no?"
700931,video_games,"As a superstar in solo 3s, I relate"
2099607,news,So Mary was a filthy skank?
2225726,news,Virgin space project took a huge dip in value when one of the test planes crashed. It's a tricky business 
262264,sports,"that's where you're wrong
"
1645317,sports,HoldGate
377554,video_games,"I bet your odds are decent on that.  There seems to be lower supply for the colored version, and it sold out first on most sites if I remember the first preorder day right.  Or you may find someone nice that doesn't care which they get.  Never hurts to ask, just be careful and check what you're getting because we've heard the boxes aren't sealed."
1095155,video_games,they were more of a superteam last year. duke &gt;&gt;&gt; huni. they should have gone for ssumday.
636351,video_games,Sent?
1111401,video_games,"Justice was served today. To all of you echo fox fans: I am really glad for you guys. 

Also i didnt think i would ever say this 6 months ago, but damn is it fun to watch echo fox play lol"
554799,video_games,"People need to focus their efforts on other things, like enjoying the game. So many people too ill-informed and opinionated to make a reasonable argument regarding these things.

I can understand *""Hey she looks a bit too thin in her costume compared to the others!""* comment, but a *""She's TOO THIN, SHE IS SUPPOSED TO BE FAT""* comment should just shut up in the first place, especially when they don't understand the amount of clothes she's supposed to be wearing in her usual outfits.

I mean, no one complains about Roadhog being fat? If it was a disgusting girl/woman there would be online-protesting for crying out loud.

It's hard to imagine what's going on in their heads."
339286,video_games,Dorsetts legend is still hard to play against lol 
2301133,video_games,i just got a text from blizzard saying they read this and said ok. nice job thinking this up.
453666,video_games,They've done midnight deliveries for other things.  That Harry Potter book that came out last year - my wife got one delivered at like 1AM local time.
434152,video_games,I'm trying to attend as well and trying to sort out my plan of attack.
93339,sports,Would hardly call Guppy shit
1475956,news,[removed]
1301014,sports,"Non Portland pick this year, Portland pick next year, plus meyers leonard for salary purposes. That's what a Lopez trade looks like to me"
181566,video_games,"well if you are assuming your opponents are bad then you can get away without bkb. But if you are against gap closers that will use root on you for example, you'll need bkb. as a sniper you are usually the prime target of the other team so you want things that can help your positioning and bkb is there to bail your ass out of they do manage to get on top of you. it's a pretty common item on snipers really. "
75062,video_games,There not using click bait. I just used them for examples as large youtubers :) 
2109613,news,"I personally am fine with amnesty for a lot of the immigrants already in country (hear me out, don't downvote yet).  But I agree, 2 decades of being in the US after using a fake identity really does not net much sympathy from me."
2029838,science_and_technology,"I've been to many events. Have you ever read an entire comment on reddit?

&gt;Or you could have a flag waver like they generally already do"
1015223,sports,UGHHH
1011900,sports,He was pulling his stick down with his stick. Classic agitator move.
558993,video_games,"Nope

I've just spent a lot of time into the game

And now I'm burnt out lol can't play more than one hour a day. I guess Ill buy the D.va skin"
1930641,sports,You didn't pick a better week to make this comment with a flair like yours... seriously.
1073481,video_games,"No, because that takes away from riot and twitches income. If ad companies find out that a percentage of viewers aren't of youtube/twitch they may pay Riot less. Your asking for too much..."
1210695,sports,basketball bobby fisher.
