,cat,txt
1416791,news,"Reddit seems to be in love with them lately, which honestly, I am fine with. It's not like it's a new concept, though I'm sure we have a lot of modern ones of varying quality. A well curated list would be pretty awesome actually. "
1608695,sports,The chances of finding a franchise QB are pretty slim tbf. The draft and FA are both a crapshoot most of the time when it comes to the quarterback position.
1030325,sports,"&gt;Giordano goes full Mike Smith

Oooh this should be interesting, I wonder what he did

&gt;with a 190 foot shot into the centre of the net.

Oh..."
24206,science_and_technology,Does this curve seem a little too big to anyone else? I think it would cut off a not insignificant amount of screen space.
1172068,sports,Another example of referees officiating to the score.
1155338,video_games,"I hear Tobi say it way more than qt, but his is more catchy "
778953,science_and_technology,"If you clean your screen with only a microfibre cloth, then no"
2235672,news,"My commute would take me through Reforma every day during the protest, and I did not mind it at all, because it was democracy at work. If there was no rigging, why weren't votes counted again? All criticisms were direct personal attacks, never backed up with evidence.

I also remember between Ebrard's tenure and his the  funding of the Universidad AutÃ³noma de la Ciudad de MÃ©xico, Universal Basic Income for seniors, the remodeling of the Centro HistÃ³rico, the MetrobÃºs, the upper level of PerifÃ©rico, las prepas, alcoholÃ­metro, the bike lanes, legalization of abortion, the 12th subway line, ... You know, good stuff. "
105536,sports,"Actually when cricketers from other countries retire, they stay retired."
2084682,news,reevaluate yourself
597033,video_games,If you ski/snowboard or enjoy any winter extreme sports this game is for you! You have challenges but the open world is where it's at! Endless possibilities and you can goof off with friends :)
1123100,video_games,[removed]
886088,video_games,"It really doesn't happen often that stuff on this subreddit makes me laugh, thank you."
1502075,news,And if you don't have $20 of cash?
532917,video_games,can confirm
123713,video_games,not well....that never goes well..just sit there and listen to how cute her dog is and like it.
1620113,sports,Bill is not trying to get Brady more recognition. He'll do the right thing
49160,sports,"So how long before the practice is outlawed for basically being a workaround, I wonder?"
1177319,sports,LMA continuing his sucking.
1520488,news,"Russian ice, nemesis of emperors"
1291920,sports,"It's a good thing one of [New Orleans' highest rated restaurants](http://www.nola.com/dining/index.ssf/2016/05/shaya_best_new_restaurant_jame.html) is an Israeli restaurant, then. 

Casspi is staying for life. "
1794078,science_and_technology,[removed]
963147,sports,I seriously believe it's top 3 greatest sports jerseys of all time.
1651539,sports,"Knowing the Bears' luck, this will be another Brock Lobster situation"
2064075,news,"It's propaganda, but it's crafted, disguised, and shipped out in amounts rarely seen outside of dictatorships. The idea of it being ""weaponized"" is that rather than simply misleading and promoting a Russia-favorable point of view, it's being used to control and *heavily* damage its targets. Similar to how Trump's team attempts to use propaganda to *destroy* trust in objective reporting and force them to reprint lies, rather than simply get the reporting to come across more favorably to them."
322383,video_games,I don't have a problem with  people being disappointed as nobody can. People can feel whatever they want. But the bitching and such is what's ridiculous. And as far as the mass camo update well that was a big f-u to the player base that didn't use the key glitch imo. Just my 2 cents tho 
1015781,sports,Brilliant^(like his smile or w/e).
208560,sports,Oh come on i said the same thing a couple of weeks ago and people insulted me and killed me with downvotes
618536,video_games,"If you ever get back into D3 look for a control option called force move. Most people set it to mouse wheel. No clicking required, you move towards your pointer."
2335509,video_games,Except for the fact that they stated the next game they're working on will not be an Elder Scrolls game or sequel to Skyrim. 
741009,video_games,"True, I'd buy it. I'm just having an image in my head of a swan with fangs xD. You'd have to make the laugh the honking of a swan or whatever noise they make. "
1148389,video_games,Like Runaan on kayle.
1625101,sports,"You are right. Never use stats to judge a players performance unless it suits your narrative. 

PS in their first 6 starts, Kessler was second among rookie QBs in passes greater than 20+ and 40+ yard only behind Prescott.

Ogbah had the most sacks on our team at 5.5 

&gt;Browns LB Emmanuel Ogbah totaled 5.5 sacks during his rookie season, which tied for 3rd in the league among all rookies. However, on average, Ogbah was one of the closest rookie defenders to the quarterback when rushing the passer as he had the 2nd best average separation from the quarterback at the time of release (4.35 yards).

This is from the NFL all rookie team webpage "
2189777,news,Could you provide some examples of people called racist for not trusting the government?
726915,video_games,Hate playing against him but when I do play him I find it hilarious when people can just be deleted once the corpses are blown up
1315243,sports,Put that on Shaqtin a Fool
1534257,news,"even after controlling for precinct variability even after controlling for precinct variability even after controlling for precinct variability even after controlling for precinct variability even after controlling for precinct variability even after controlling for precinct variability even after controlling for precinct variability even after controlling for precinct variability even after controlling for precinct variability even after controlling for precinct variability even after controlling for precinct variability even after controlling for precinct variability even after controlling for precinct variability even after controlling for precinct variability even after controlling for precinct variability even after controlling for precinct variability even after controlling for precinct variability even after controlling for precinct variability even after controlling for precinct variability even after controlling for precinct variability even after controlling for precinct variability even after controlling for precinct variability even after controlling for precinct variability &gt; even after controlling for precinct variability 

"
1606091,sports,"7 ""Saints fans"" who are bandwagon falcons fans.

Well, we know the Saints have 7 bandwagon fans."
1396879,sports,This is a retarded statement to make.. 
923217,sports,Boro's been taking runs at Jack all game
1519819,news,"Shh, feels &gt; reals. Like obviously Netanyahu visiting in Trump's first month and Obama consistently holding Israel to a double standard are just alternative facts. Antisemitism is a negative thing, and we all know that conservatives are every negative thing conceivable. "
681715,video_games,But you're shuffling quickly 
1155001,video_games,lol alytics stats for udyr 
1595748,news,"... Are you seriously claiming he has not said such things???

You do realize that being gay doesn't magically mean he can't be racist or homophobic, right?"
350375,video_games,"Cinnamon Frosted Flakes

Edit: saw that it was already said, I'll go with Cocoa Puffs!"
905109,video_games,If she was in any threat she could have Whirlwinded out of it pretty easily. Or just stay in it and heal off the zombies.
819955,sports,I feel sorry for that ball :(
202947,video_games,dude no offense but when SEA hits 4am your people invade our servers... all i hear is them screaming in broken english or tamil
172215,video_games,"No, my hero literally walked directly the other way instead of eating the tango, and didn't use it anyway."
1280116,sports,All shall bow to the F5 God. 
46266,sports,Well New Orleans coaches are currently forming a coup d'etat against Coach Eaux so I guess Texas is not alone...
911089,video_games,"Seems like full Corpse Spider build, with Widowmakers at level 1 and Hexed Crawlers at level 4 is gaining popularity in competitive play. "
1370405,sports,for doing what every player does when someone drives past them?
2305891,video_games,"IL 908, 7/10M Elemental Shaman to help answer questions!  
[Armory](http://us.battle.net/wow/en/character/zuljin/Divenarious/simple)  
Logs are unfortunately private!  
  
I will get to answers as soon as I can."
1396512,sports,"who can blame him, he should enjoy himself as much as he can during the break"
1295502,sports,Such a stupid thing to say. My guess is you're 12 years old.
1976284,sports,Video please :)
594879,video_games,[removed]
817092,sports,Twins fans know how much of a jerk he is/was but for some reason they love him for it.  
906112,video_games,"Party on the objective, who's in?"
1383104,sports,Don't be rude.
239877,sports,Yep. But they literally do it just before like witjin an hour of it all. 
425918,video_games,Ive seen this a lot today; what is a testfire? Is it like a beta?
1538367,news,"I believe being raped and having the baby in you and wanting it out would fall under my ""unless medical necessity or SEVERE PSYCHOLOGICAL TRAUMA is endangering the mother"" clause."
229126,sports,Just got even worse! I'm now 4-12 honestly don't know how I'm gonna recover this
121120,video_games,"Apotheosis is the only way to ""kind of"" get double grenades on stormcaller. Chuck grenade, pop super, chuck grenade, roam."
861351,video_games,"Recommended weapon level for Irithyll is +5 to +7.

At +5 people can match with your +8 weapons, so I'd say you should be fine. There might be the odd person that manages to not find all the Titanite or spread their Titanite thin. But considering how many Large Shards are in Irithyll I feel like this isn't worth worrying about.

Basically, feel free to go to +8."
448322,video_games,"I think it's based on the order they are in Amazon's systems, and the order doesn't exist in their system until you get the auto-confirm email."
1482407,news,"Odd, why would Muslim terrorists offer to help a Jewish cemetery?"
1224328,sports,Past seasons don't count?
2344006,video_games,I have just been round long enough and have become very clinical 
1598421,sports,"Only won by one touchdown, this team is garbage"
2241160,news,My friend drove drunk once and made it home fine so it can't actually be a bad thing right?
1217645,sports,"""GM Byron""
 
*shudders*"
1987778,sports,"From the thumbnail, it would appear that jug is either broken or melting. Either way, I'm not sure it's very well-suited for holding much of anything."
633247,video_games,You're welcome.
2180042,news,Maybe Tiffany had an affair with a Mexican therefore Donald hates Tiffany and every Mexican
2314278,video_games,"If I remember correctly, SvTM turned into a melee meat grinder like Ashran because ranged could just hide in the ""fog of war"" or whatever."
673686,video_games,riPepperonis
879518,video_games,That is horrific.
113513,sports,In honour of matt renshaw im holding a shit in until stumps
2034780,science_and_technology,"Agreed, a joke for a lot of reasons... but one of them that hasn't been pointed out yet is unlike any other car that can accelerate like that, the Tesla's traction control doesn't allow the wheels to slip even when accelarating that quickly. The microsecond it detects wheel slip, it applies the brakes to that wheel. I know this because as someone who occassionally dabbles in rallying, it's the reason I didn't buy one. A few years ago they did allow you to turn the traction control completely off, but then decided against it as a company. So even accelerating that quickly shouldn't have broken traction - I'm guessing most of this is on the booze. "
2097967,news,"I would have addressed the issue if there was one.

When you start a comment off with ""kek"" there's nothing to discuss. Show a bit of maturity and maybe we can have a discussion."
440905,video_games,"Uh yeah they are, I literally just did that with Uncharted"
1465251,news,Volkswagen cheating doesn't reflect on the EPA and its work.
1989263,science_and_technology,"So this post would probably be better for r\SCCM, but if you want Win10 support you need to have your SCCM at 1511 or newer.

https://www.systemcenterdudes.com/ is a site that will help you with the upgrade process.

A valid System Center Software Assurance agreement allows you to use whatever version of system center your little heart desires. There isn't really one called '2016' though. 

If you don't have a TAM at Microsoft, CDW should absolutely be working with you, if that is your VAR."
2008076,science_and_technology,"""states"" aren't objects, they are a punch of people. Cali still has a huge huge effect on politics. The system your proposing would silence all the people that don't live in the biggest states. In essence in your example, the ratio of a vote's weight would go from .9:1.1 to 2:0. It would lead to far worse equality. "
2280092,video_games,I for once was blamed by a rogue for my shit tier healing cuz he died like every 5 minutes in a BG.... i was playing Blood Dk 
2268942,video_games,"Well I just got the bracers lol. I guess the key is to constantly bitch until you get them, it worked for me. "
748371,video_games,"No I don't think we can beat challenger cup level teams so I want us to get into smaller tournaments that could help us improve since we can't 5 man queue in ranked. Do you know the name of the tournament your friends were in?
"
674506,video_games,Forsure just have to be a bit more careful with him now that's all 
1456087,news,Too busy with war on drugs
105753,sports,"Yeah, he's like our Broady. "
2227813,news,"I got you, fam. His source is Peter Springare, a Swedish policeman, who posted *on his Facebook page* about his workload, where for a week many of the names of criminals were ""Mohamed, Mohamed"", etc.

Google searched for: Peter Springare police

Came up with 3 sites running the article: Foxnews, Breitbart, and Blue Lives Matter. That should tell you plenty. "
2085803,news,Well at least in brazil ik journalist flat out lie. A friend of mine was interviewed and the article states something he never said. It was not paraphrased or reworded he never said what the journalist wrote 
866928,video_games,"&gt;  It seems that besides cases where multiple lords of cinder work together, no single lord can normally link the flame more than once. It takes 6 fire linkers (five Lords and one Ash) to do what a single Chosen Undead could do.

what do you mean by this?"
2272555,video_games,Stellagosa
604468,video_games,No ubisoft 
956364,sports, Was right :)
558782,video_games,Minoria
209133,sports,"I think A) B) C) D) but no matter what, goalkeeper last I'd say."
2238145,news,Page not found
269431,sports,Higuain will be upgraded 1000%
1920502,sports,"Walcott fall over his laces or summit ? Hmm, probably just his touch init"
1123360,video_games,[deleted]
1370087,sports,Yeah he will be more aggressive and it will be fun to watch
2064565,news,"Everything isn't fine, but as far as the numbers go, the refugee intake has had no real effect on the crime statistics so far. The increase in rape isn't actually an increase in rape but a change in how rape cases are handled and what counts as rape. Not to mention that a lot of work over the years have gone into assuring people that there is no shame in reporting rape and for the police to handle it better(they as far as I know are better, but for obvious reasons they don't survey people). The biggest change is in the amount of coverage by the media. 

As for the bombings, they are an issue of concern, but they have fuck all to do with refugees in any case besides the ones where they are being bombed. Given that they have no actual opportunity to travel to the Baltic countries where on the black market the hand grenades get purchased I don't really see a reason to argue that they are the problem.

The biggest threat to Sweden isn't the refugees themselves, but the utter fail that is our integration policy. Realistically as long as refugees are placed in large groups they have little to no incentive to get to know any Swedish people, which doesn't facilitate integration. But I understand all three parties(government, refugees and Swedes) in this, as far as I can tell this would be the most common stance(no immigration and all immigration being the extremes and outliers with most people being somewhere in the middle). They get placed in the cheep places because they are cheep. If Sweden became a war torn hell hole forcing me and others to flee and where ever I end up they place me in an area where most of my neighbors spoke my language and knew my situation I can't say that I in my free time would spend it getting to know the locals.  As a local I understand how frustrating it is as it becomes a us vs them. Which is incredibly sad as it doesn't have to be that way. 

So, is the situation perfect? No. Is the situation horribly unmanageable with people getting blown up, shot, and raped all over the place? No. Could it be better? Sure, but as it could also be worse I don't think it's all that telling. Should we trust Trump on the matter? Only if you also think that eating sand is a good idea."
1386879,sports,...like 2012?
2343361,video_games,I'd pay a little extra to see Major Nelson on my screen 24/7
1581566,news,"They can pry my marijuana from my cold, dead hands. "
1108870,video_games,How about Smite TP Top Shyvana/Hecarim/Fizz
1340856,sports,[deleted]
1626352,sports,"TBH I'm not mad about picking the Cowboys or Packers and certainly not the Pats.

But nobody gave us a chance against *the Bucs*!? The Jeff Garcia lead 9-7 Bucs who clinched a weak division and backed into the playoffs despite losing 3 of the final 4 games of the season? *Come on.*

Also had the Giants lost that game it's highly probable that both Eli and Coughlin get run out of town."
879770,video_games,I would show you I put them on but Imgur is being a butt
352997,video_games,"was testing out my lineup in a random domination game because i got a new guy and wanted to see if i liked him...well blake decided to end powells life in the process, idk what the injury was but he didnt come back in the game

edit: jesus christ i meant powell not mejri in the title "
1844206,sports,and barca wanted a freekick after every single one of them
309003,video_games,"Definitely possible. Create a million fake Steam accounts set to public that own the game, and have them register as having played the game every couple of weeks to make the game seem more popular than it actually is. It's possible, yet much less plausible than Riot making an exaggerated claim."
572848,video_games,"Would you say you....""need healing?"""
2096317,news,"AKA Finland's defeat ;)
&gt;As the Finnish Cabinet hesitated in the face of the harsh Soviet conditions, Sweden's King Gustav V made a public statement on 19 February in which he confirmed having declined Finnish pleas for support from Swedish troops. On 25 February, the Soviet peace terms were spelled out in detail. On 29 February, the Finnish government accepted the Soviet terms in principle and was willing to enter into negotiations"
1251445,sports,"Just say ""blew a 2.9 million vote lead in the election"" 

The way it reads is that she had a 2.9 mill lead in the electoral college, which she did not. "
757578,video_games,"[Condition overload](http://warframe.wikia.com/wiki/Condition_Overload)

But yes you need something too survive. Naramon focus usually helps"
987463,sports,No I was assuming I was the monster and you were boo
938882,sports,"CHEER FOR THE FLAMES, DUMMY!"
2039902,video_games,I think it's based on where you're looking. If it's obstructed it goes out from there until it finds the nearest spot in that direction. 
1269299,sports,"&gt;he deadass thought this was fire and danced to it too 

Are you from New York?

"
1883457,sports,"&gt; It was very fun to do.

Tagged as ""masochist""."
2262544,news,Saudis were never banned - it was just the countries that had no involvement with 9/11 that were affected.
649755,video_games,"Haha no way, you definetly deserves a diamond charm for that."
1380382,sports,Russel Westbrook. That's how. Replace robersons shooting with the average sf in the NBA and we'd score 10 more points per game. It's ridiculous.
1316848,sports,You could always sell the coke if you don't want that burden. 
1638598,sports,Because it pretty much is based on the Pats offense and defense.
200120,video_games,While the kotl on my team blasts people out of static storm 
1993743,science_and_technology,The solid / blinking lights are why my work e-mail is not on my phone and my phone is banned from the bedroom. I have not succeeded in extending the ban to my non-sysadmin spouse's phone.
1977755,sports,"idiot, meet yourself"
1326377,sports,How do they not talk about that in the highlights? I've been watching ESPN and not once did they mention that that's insane
1414071,news,"""U.S. military officials told Reuters that Trump approved his first covert counterterrorism operation without sufficient intelligence, ground support or adequate backup preparations.

As a result, three officials said, the attacking SEAL team found itself dropping onto a reinforced al Qaeda base defended by landmines, snipers, and a larger than expected contingent of heavily armed Islamist extremists.""

http://www.reuters.com/article/us-usa-trump-commando-idUSKBN15G5RX"
1384063,sports,Brace for king of the fourth guys.
1880366,sports,http://rationalwiki.org/wiki/Gish_Gallop
228872,sports,no you dont
2293818,video_games,[deleted]
877484,video_games,"I'm not, sadly... but thanks for the offer! That's very nice of you :) "
261150,sports,[deleted]
449331,video_games,It's a custom resolution. Not standard but it's still not full HD so technically 720p still. Anyways whatever. 
971270,sports,At this moment Ej is our star defenseman. Wouldn't say he's a super star but he's solid. Hoping zads keeps making strides next season since he got FUCKIN INJURED IN PRACTICE FUCKIN SHIT FUCK 
66797,video_games,[removed]
406100,video_games,"Matching the current Pro Controllers with the color schemes of past systems' controllers?  Yeah, that would be cool too.  I hope Switch is really successful so we see most of these dreams come true."
1133112,video_games,"Yep, if I'm not FPing Malz, he's banned - Just like Camille.

Number 
1 banned support, highly banned midlaner.

"
1485902,news,Obama sure pushed hard for police reform...
101022,sports,"I'm not too sure why you think Zampa would have done well. 

Can you please explain? "
1473027,news,Why should it blow your mind that someone does not have an ideological but rather a practical reaction?
893835,video_games,"That honestly confuses me. Fuck Varian and Murky but did anyone really ever think ""God damn Tychus is too strong""? Cuz if so...I've never witnessed it."
698427,video_games,"1. The Like/Dislike system is not meant to block maps you dont like, you have to play them all whether you like or not. Devs mentioned all the maps are supposed to be played and more non-standard maps are coming.

2. See ""1.""

My question to you is, why do you hate those maps so much?"
1842946,sports,That is the difference between pepe and all other defenders ^^
625700,video_games,"I guess, but it is still a kind of questionable choice."
927387,sports,"What a surprise, we can't score tonight! Love watching shots on shots on shots each night"
97261,sports,Rhymes with ATM
1574849,news,[deleted]
2341356,video_games,[deleted]
449648,video_games,Any news for Animal Crossing on Switch? 
55619,sports,"IIRC, the Arkansas QB at the time, Matt Jones, did. I remember watching those games and him being the reason they were still in the game. He was actually Cam Newton-esq in stature and Manziel-esq in elusiveness, while visually appearing to be about as mobile as Peyton Manning. Kid was a decade ahead of the offense that really made those type of players work so well at qb. "
1468270,news,[removed]
1909621,sports,They tried to catch Eriksen out earlier in the day but he kept passing.
2176344,news,I'm not sure where I'm going with this anymore!
687201,video_games,"I've been a Siege player since day 1 on PS4 and never have I ever had as many disconnects or issues connecting as I have since this latest update :( 

Hopefully Ubisoft does a massive overhaul of their server infrastructure this year that improves the QoL for everyone."
1305668,sports,Hope it isn't too bad. He may be the most important player to that team.
1486808,news,I really don't know how 
371525,sports,Noah looks like dogshit 
16879,science_and_technology,"Are you on JUMP on Demand? This only applies to EIP, not JOD leases"
1201929,sports,Badass
657742,video_games,sad that people post other peoples stuff for upvotes
1755921,video_games,I actually prefer earning cash from Google rewards and gyms more so Im not as Lilkely to need support.
417213,video_games,Strong argument. Strong points. Very well said friend.
1289351,sports,GSW TWEETER PERSON YOU CALLED IT
690762,video_games,When you try to use a Serenity spot.
604091,video_games,"Who likes 1886? Why are so many people mentioning that game? :O

But yea Bloodborne is correct."
1945053,sports,#ZAZA YOU BEAUTIFUL BASTARD!
1513854,news,"I do, its an economic tool used by those who hold the wealth to protect and get more wealth abroad. "
