,cat,txt
2087574,news,"&gt;Ethics Reform, not Lobbyist Ban.

It's literally the [same shit](http://www.npr.org/2017/01/28/512201631/trumps-executive-order-on-ethics-pulls-word-for-word-from-obama-clinton) that's been in place for the last 20 years. It's no change packaged up in a nice ""drain the swamp"" soundbite so you can feel better about yourself. "
162882,video_games,I'll have to recheck names but they were for sure playing like brain dead bots
1635499,sports,[deleted]
1912025,sports,"Exactly. But I don't think Lucho has the tactical nous to actually change the system appropriately.

That and there's only one player who can do what Dani Alves did on the right and that's Dani Carvajal. And he's not available to Barca for any amount of money."
1338181,sports,"What, are you seriously suggesting that you let your star player get injured? How?"
2160260,news,What flaw
5283,science_and_technology,On the S5-Note7 all you had to do was press the home button to wake everything up and turn on the screen. There was never a need to press the power button unless the phone is off or you were shutting the screen off.
1149793,video_games,Tryndamere if you really want to learn how to win soloq
260053,sports,"I'd say Ruffuri or Mandanda  , how ever you spell it "
1229456,sports,Flair checks out. 
116915,video_games,OH NO THATS THE ANTHRAX THAT WAS LEFT FOR THE SANDBOX TEAM!
1774530,video_games,I have a Kanggaskhan under seen (I'll have my phone on in my pocket while working &amp; didn't feel it buzz) and I've never left the states)
1400198,news,"The moderates enable extremist thing only applies when moderates make excuses for the extremists. 

Although I don't agree with /u/Jimmy_ya_dumb_bum, he/she is not excusing the crazy pro-lifers. "
1000390,sports,Kitty's win!
927883,sports,Goddamn the jimmies have been rustled in here
346598,video_games,About 40k?
1558063,news,Captain Planet!
1132675,video_games,"You see comments in this sub sometimes, and you just know immediately it was written by a kid. "
1247824,sports,[deleted]
464575,video_games,"Could just be an independent VR head set, like the PSVR, at least that would solve the resolution problem. "
1228251,sports,Honestly MCW was clamping him. Thought both players were fouling each other.
77463,video_games,Im lvl 10 in arena 10 and still not a single super magical chest
1500304,news," A guy posted a link to a PDF with PAGES of them. No fatalities since 2006, but still there have apparently been a lot of failed dams."
1722936,sports,[removed]
230975,sports,"Yup, definitely IF baines and maybe courtois/de gea for me. Would you recommend pogba (88) at CM? "
687491,video_games,"It wasn't accurate or useful anyways, oh well. "
1078242,video_games,[removed]
1294136,sports,"Damn, that's how good the Celtics and Lakers were throughout the NBA.

SHEESH, that close"
67317,video_games,Pairing gob barrel with princess is risky since log is very common. If they know you will try and do a gob plus princess next time they'll literally just save thr log to get a 2 for 6 elixir trade
155181,video_games,its actually incredible how many people don't understand the meaning of his comment
1423657,news,"I hate TD but that's not what would happen. Pretty certain it'd just be a ""sure this is a good deed but plenty of non Muslims do good stuff too, why does it need to be focused on their faith as leftist propaganda"" type deal."
7587,science_and_technology,I don't work for either Google or Snapchat. Ask them yourself
988301,sports,cats game starts in 15 minutes how am i going to stay awake ahhhh
1939970,sports,[deleted]
2193843,news,As I've said those leaving the CDU regarding immigration will find the SDP gaining power because of it. Plus AFD seems to be primarily dominate in East Germany
2110573,news,"How about you do your own research, as I did mine."
1785412,science_and_technology,How many of these garbage articles do we really need?
1318998,sports,Still impressive 
2292956,video_games,I'd be too! Money money moooonaaaay!
1467006,news,"I just think it's amusing that if you make fun of people with predatory sexual urges on reddit, someone will always rush in to defend it with hypothetical edge cases."
8331,science_and_technology,I've noticed it loads a bigger version of gifs than Sync and others. Sometimes these are even 30-40 MB. 
1528412,news,"It has everything to do with this. Nearly all of our laws and our entire society in the west are based on ""reasonable person"" standards. Women unfortunately have a unique responsibility to be reasonable in making a decision that ultimately could mean life or death for a baby. Babies are unable to escape being killed against their ""will"", by your standards. You're okay with killing a full term baby because the mother should be able to change her mind at week 40 after KNOWING for months and months?"
1836455,video_games,What
1123029,video_games,"&gt; I mean it sucks to have to level up a 2nd account to 30

You just have to start early enough with it, when you don't need it yet. 

Everyday one Botgame on Twisted Treeline as warmup CS training takes 10 minutes and will net you an LVL 30 acc. with quite some IP someday in the future. First win of the Day bonus really adds up, you get up to 6000 ip per month!"
242639,sports,Being down 5-2 at the 82nd minute against a complete scrub / dabber / replay watcher and coming back to 5-5  before winning 3-0 at the PKs shout-out including a final panenka. 
259987,sports,"https://www.futbin.com/17/squad/2063287 
Packed Reus and was wondering if it's worth using him (my friends told me to do it), I built this nice squad, do you think il will play well? "
874617,video_games,"No? Read deeper into his lore. He's a twisted, mad, demented, mutant, half-dragon."
1671368,sports,"It gets better, but you may never watch that game again. Your team is talented and well-coached; you will be back.  Atlanta deserved to be there.  (I've never watched the 2007 SB again.  It may take something happening to erase it.  Last night's Edelman catch makes me understand how Giants fans felt, and in some way cancels out the other.)"
1527656,news,"I'm not afraid, I'm exposing these cockroaches for who they are."
1692737,sports,"I always wonder if people outside Broncos Country are aware of just how great Gradishar was. It's awesome to hear you mention him. Hell yes he should be in Canton! He would have been a first ballot Hall of Famer if he had played for Pittsburgh, Dallas, Oakland, etc. 

The Hall has very little credibility to me until Randy Gradishar is inducted. "
745059,video_games,"As far as I recall Bluestone doesn't get procced by his 1.

I haven't played him super recently but I'm 100% sure that he clears just fine way before that."
1553106,news,"If you saw the official statement from the mayor it certainly appeared that he did not disagree with antifa's actions.  He was angry at them for providing propaganda to the right, not for beating people he doesn't like senseless. I have no doubt he put PR ahead of those victims lives because he didn't care about those victims at all. No worry though he also claimed in the same statement that his was a community of inclusion.   
  
[Original statement.](http://i.imgur.com/MboeWYf.jpg)"
1400129,news,Is this dangerous? What type of effect does banning media outlets have?
1039992,video_games,"Surely if that's the truth, SKT and KT would always let them through. But they haven't. 

But even if you were right, the scenarios in which this is a good pick/ban strategy are so few that it hardly counts as the red side having ""choice"""
151283,video_games,I think he's just being sarcastic
917191,video_games,[deleted]
1798304,science_and_technology,"Thanks for responding!  In an earlier message, you mentioned that it might fit the criteria for r/EverythingScience.  Could I submit there? Let me know! Thanks!"
1181730,sports,We'll be fine. He's on an expiring contract and will probably be banished from the NBA after it. 
784312,science_and_technology,"So, use a cable when you want to use the phone while charging.

Wireless charging is just an additional feature available to use that is *sometimes* more convenient. I liked just placing my Galaxy S6 in my car's console and having it charge without needing to deal with a cable (and in a car, you can just use your car's media controls, CarPlay, Android Auto, etc. to do most everything you need to do on a phone while driving)."
1653383,sports,[deleted]
407851,video_games,When will we be able to purchase on prime now ?
1878256,sports,What's a clucker?
1807090,science_and_technology,[removed]
770712,video_games,"No, thanks. I like my Marelok, Sobek, Hek and Penta to explode automatically in the middle of the fight, I don't want to keep my eye on that small icon in the corner of my screen to check if they ready or not."
1347487,sports,"That's not enough.

D'Antoni said 50+ for the rest of the season, so we need to do 50+ for the rest of the season"
1770093,video_games,"Your submission has been removed for the following reason(s):


* Rule 2 - Please use the search bar or google, this question has been answered 



---

For more information, see [our detailed rules page](http://www.reddit.com/r/PokemonGo/wiki/rules) and [FAQ](https://www.reddit.com/r/PokemonGo/wiki/faq) on the wiki.

If you have any questions or concerns, please [message the moderators](https://www\.reddit\.com/message/compose?to=%2Fr%2Fpokemongo&amp;subject=about my removed submission&amp;message=I'm writing to you about the following submission: /r/pokemongo/comments/5swsjl/i_havent_seen_in_the_posts_for_the_valentines_day/. %0D%0DMy issue is...)."
1511658,news,"A well regulated militia, being necessary to the security of a free state, the right of the people to keep and bear arms shall not be infringed. "
2210499,news,One link is asking me to sign up the other says nothing like overall only 1-5% rapes are reported. 
1152512,video_games,"It would have to be legendary as the animation for everything would need to be changed, not just the particle effects."
1028773,sports,Thrown into a 4th line grinder role that destroyed his development.
1904076,sports,IVE LOST MY SANE-ITY
2317722,video_games,"&gt;
    eÂ·valÂ·uÂ·ate  
    mathematics  
    find a numerical expression or equivalent for (an equation, formula, or function)."
1424624,news,You caught me. 
1123837,video_games,Lunch
722805,video_games,Thank you!
751050,video_games,[deleted]
257839,sports,"I think there is a large premium placed on possession this year. Common sense would dictate that your favored 442 diamond formation should work, but it seems like marking has increased. So that being said, I think its good but there are other formations that work better that can spread the brunt of possession more efficiently. Slow build up pays off."
1300444,sports,mark my words: Buddy Hield WILL BE the next Ben McLemore
1293534,sports,Anthony Davis vs Razor Blades
2341201,video_games,they use the same faceplate other than the profile toggle on the elite
146068,video_games,Bring back shot package and year1 final round? I'm on board.
1712619,sports,Oh that's unfortunate....
863722,video_games,Why is it that everyone who rips on BB happens to be a pcmasterrace person??
1816111,video_games,"You have to fill up soul gems, then press f in the inventory with stormfang selected.  Or was it r?"
1358878,sports,i want to die
1775354,video_games,I wish they would put some time into fixing these minor text errors.
1432209,news,"Why does the writer refer to Bush as president but Obama as Mr.?  Once a president, always a president."
891569,video_games,"I love the fear it instills on enemies, chunked a thrall once in a lane duel. Rest of the game he just nope'd out when he saw me.

Where'as with GFFT's reduced range, people seem to outrun the range too often"
1275085,sports,"Joe Ingles is by no means a max player, but he will get a solid contract after this year is up."
1159619,video_games,AYYYYYYYY was looking for this lmao baby
624212,video_games,"In terms of game reviews? Yes, of course. "
1132553,video_games,Finally Exhaust nerfs. It is downright stupid how you destroy melee damage dealers with a point and click summoner spell. 
1448773,news,"It is against the law for one thing. Soldiers are soldiers and not law enforcement officers for another thing. And things are not nearly as bad as they were in the 80's and 90's. It would be an absurd over reaction. what needs to happen is for the roots of the violence to be addressed. Putting the population under the thumb of a military occupation is not going to help.

If your reply is ""he didn't mean soldiers"" then I would have to ask who else? There is no federal police force."
1461155,news,"A zombie army might be just what Flint needs.

It might be better to just relocate them, then pave Flint under, and begin again. Do Saginaw, also, while they're at it."
1079962,video_games,[Pow..](https://www.youtube.com/watch?v=BrPxWg8JFlg)
143445,video_games,Understood! Thanks for the response. 
817086,sports,Great read 
1846152,sports,That's exactly right. 
625879,video_games,Stop being an idiot....oh wait you can't.
1729750,sports,Sucks to have to worry about that stuff
487919,video_games,"How did Roadhog get more of a buff than a nerf? The change hasn't really affected me much, I just fail to pull people I would have before on rare occasion, are there hooks you can make now that you couldn't earlier?  "
350412,video_games,"Yeah possible. My rugby knowledge consists of the haka, what shape the ball has and that's it. Can't judge the game though, lol."
2187537,news,"&gt; Then the foreigners proceed to sell these properties back and forth with each other without having even moved into the condo. They are making lots of money while high rises sit largely unoccupied meanwhile average Canadian cannot afford to buy into the market.

lol; is this how you think making money works? Why don't you ask your parents to sell their house to you, then back and forth and get rich then..."
491597,video_games,"I love these!

Frog lucio is my favorite lol"
1427816,news,"&gt;During the summer you don't notice them but fall and winter the geese are everywhere!

It's because Denver is in their migratory route when they're heading south for the winter."
1317187,sports,Was he hurt in 2015 too? 
1187992,sports,Fuckin snek
1590571,news,Are you high? You're making a huge logical jump there. Losing a lot of test cases doesn't mean a lot of his executive orders were thrown out.
1713803,sports,He will never be yours!
1959384,science_and_technology,[removed]
400771,video_games,"From what I've seen of its performance and what developers have said about the ease of porting, yes."
272463,video_games,"**Enter the Gungeon: Supply Drop Update**.  When I first played Gungeon, I said that it had replaced Isaac for me.  Then I went back and replayed Isaac, and realized that the lack of interesting, unique builds in Gungeon meant it could never replace Isaac, so I stopped playing Gungeon.  Then the supply drop update came out, and I've swung back around to saying Isaac has been replaced.  Not because there's a better passive:gun ratio than there was before or anything, or even really *anything* unique to the new update.  It's just all the stuff I originally loved about Enter the Gungeon coming back to me.  The fast movement with dodge rolls, the omnidirectional aiming, the general frenzied pace of the game, and the guarantee that your gameplay will fundamentally change depending on what guns you get I am having a blast, and when I try to boot up Isaac (in this case, only rebirth since I'm playing on the vita) I just... get bored.  Admittedly, I played a looooot of Isaac since the last time I had played EtG and maybe it's just getting old, and I do think Isaac has more staying power than EtG, but right now any time I play Isaac I just wish I could be playing EtG instead.  I'm also getting a lot better at the game-- I went from having killed nobody's past in 50+ games to killing three different pasts in four tries.

The one thing I'll say I don't like about the game, other than the lack of passives to make runs more interesting, is that too many items are unlocked through various shops.  A full run (not counting bullet hell) gets you about 12 credits, but just about everything I can buy costs 20-25.  Having to complete three runs just to add a single item to the pool is frustratingly slow,  and the update seems to have just added even more shopkeepers (which, I suppose, is great for people who have nothing to sink their credits into other than blessed runs).

**Deception IV: The Nightmare Princess**:  I knew what the series was going to be like (low budget, very japanese game where you set traps to kill ""good guys"") but I didn't realize just how... difficult the game would be.  Winning isn't super hard (at least, not the whole first stage that I've done) but getting your super elaborate traps to line up is easier said than done, and I ended up killing my targets just by messing up too many times before I could get them to work (or to fulfill requests).  Additionally, I don't particularly like that the only way I've found of getting your target to trigger a trap is to just stand near it and hope they path on it, and if they don't to just sort of run in a circle to reset them.  Plus, since the timing and pathing isn't super reliable, your first trap pretty much needs to be something instantaneous that either locks your target in place or (also instantaneously) moves them to a set position.  Not the worst thing in the world, but it feels like it's going to limit how elaborate I can make traps when the starter is guaranteed."
2244312,news,[removed]
1164857,video_games,"Oh you silly boy, if you think that warden detects all bots then you're wrong as fuck. 

And.. it's not filled with botters. Only under 30lvl where they bot to sell fresh 30lvl accounts."
2282103,video_games,*heavy breathing*
626087,video_games,"its okay, now you have more jrpgs to play friend!"
1238903,sports,[deleted]
524973,video_games,"I like to use the alt fire whenever I'm not in direct contact with an enemy. Walking from spawn? Charge it. Turning literally any corner? Charge it. Getting chased by a flanker? Turn on their weaboo ass. Hitting something far away? Use it since their is little if any fall-off damage.

I also like to use it on tanks. Most tanks have an ability that protects them. Seeing my juicy robotic ass makes them forget about that ability until I put on some serious hurt. The alt fire presents the opportunity to either kill them instantly if you somehow land all headshots or at least force them to waste their heal/defensive ability and back off.

If I'm in combat range, it doesn't make sense to use it as you put out enough damage as Zen with your regular fire and have the support of your team without needing the burst damage."
897990,video_games,"No joke, I always played him as a squishy killer.  Way more effective that way.  "
841491,video_games,I think it was because he was moving away from the shot and it very narrowly missed him. 
214770,sports,and an assist now 
789445,science_and_technology,VoilÃ *
1551483,news,This time with stoners... should go well.
1614188,sports,"Ive been to one of em.

Colts Cheifs 2013 playoffs. Was an amazing game I think the Colts were down 31 *5 minutes into the third*"
1766779,video_games,"some was born in the late 1990s or early 2000. Hit the road son, only genuine Pokemon players are allowed to play Pokemon Go. No childrens who protest Trump day in day out."
304144,video_games,"They had no idea the PS4 was going to sell so well *before* it started selling, so that's no excuse. "
1548032,news,"I last visited Paris in 1994, but lived in NYC from 1999-2013 (and I grew up just outside the city and went there regularly from the '70s through the '90s). Paris in 1994 did not seem like a dump to me. My friends and I drove all over the central part of the city over the course of a weekend and there was nothing about what I saw that me think it was dirtier than NYC.

Much of NYC has been gentrified in the past 20 years, to the point that Manhattan and parts of Brooklyn and Queens are now unrecognizable from their state of disrepair in the 1970s. Locals refer to it as the ""Disneyfication"" of the city. It's still dirty by small town America standards, but not what I would call a dump. 

Obviously there are still bad areas that are ugly and trash-strewn, but they are shrinking with every passing year."
1347360,sports,Now that we're bad you guys have been taking care of our spot.
624075,video_games,so the physical disc itself is exactlly the same from the first on that launched for the ps4 and the one from the collection?
1963710,science_and_technology,[removed]
811239,sports,That's a pretty bad ass story 
1628777,sports,Catch the fucking ball
1540029,news,"It's fine, it matters not to me. If he is pushing some political agenda, let him. I was simply pointing out the discrepancies between the way in which he presented this article to Reddit, which I felt was rather misleading. I am not saying that it's wrong to disagree with me, feel free to do so. That's what's so great about free speech, people with all kinds of views can come together and discuss topics.

Also, I try not to judge an online user by their rhetoric or comment/post history. I simply engage with them assuming they are my equal. Sure, he may frequent TheDonald and have certain views, but he is free to do so, and there is absolutely nothing wrong with that."
1368245,sports,Vince Carter is Aldridge's new dad
1916866,sports,no card?
2093616,news,"Yeah that was my only issue. He is saying ""They never denounced Trump"" and I'm very very very far from liking Trump and I know that aint true..."
1375159,sports,Forgot about that Warriors game. I was so conflicted rooting for the lakers that day 
2242360,news,"This is the best tl;dr I could make, [original](http://www.cbc.ca/news/canada/newfoundland-labrador/child-sex-doll-trial-1.3976228) reduced by 93%. (I'm a bot)
*****
&gt; Collins, who was qualified by the judge in the case to give his expert opinion at Harrisson&amp;#039;s trial, wrote, &amp;quot;In my professional opinion, the possession of a sex doll is just another form of depicting a child for a sexual purpose and therefore would meet the criteria for child pornography.""

&gt; He feels strongly that a sex doll is not only child porn but that it could lead to an actual sexual assault on a child.

&gt; In response to questions from the CBC, one of the founders, Ethan, wrote, &amp;quot;Child sex dolls would certainly not qualify as regular child porn as no child was involved in the making of them.""


*****
[**Extended Summary**](http://np.reddit.com/r/autotldr/comments/5trd7h/child_sex_doll_trial_opens_pandoras_box_of/) | [FAQ](http://np.reddit.com/r/autotldr/comments/31b9fm/faq_autotldr_bot/ ""Version 1.65, ~63119 tl;drs so far."") | [Theory](http://np.reddit.com/r/autotldr/comments/31bfht/theory_autotldr_concept/) | [Feedback](http://np.reddit.com/message/compose?to=%23autotldr ""PM's and comments are monitored, constructive feedback is welcome."") | *Top* *keywords*: **child**^#1 **doll**^#2 **sex**^#3 **pedophile**^#4 **people**^#5"
932068,sports,"Nah, nah, Jim Jackson, Provorov absolutely saved a goal, what a play"
1196807,sports,[deleted]
2093591,news,"But we cant fight it.  Republicans have all the power and they LOVE this shit.  They have fallen in line, like they always do.  Now they will privatize the commons and give their rich buddies more tax breaks. Its a great time to a white-straight billionaire!"
461454,video_games,Love the top right one. 
437718,video_games,"It is used for the Joycons. 

I heard that apparently the Wii U also uses Bluetooth. "
1157527,video_games,Teemo doesn't say 'one' though.
1747550,video_games,"I usually only play going 20 MPH or below and that's only in certain areas. But yes, I've been in many near-collisions because of it. That's why you have to play while driving when mostly everyone is asleep."
2311948,video_games,"Confirmed deleting cache worked, side note this occurred immediately after completing the Pet Battle World Quest defeating Rocko"
1147626,video_games,"Its the same. With the old client, it was opened in the background. The task manager shows it."
850597,video_games,"No, when one team gets the tank spawns of the other team. Usually right after u destroy enemy tanks they often end up spawing for your team. Then you have one team with 3-4 tanks and the other with 1 or 0. Happens really really iften in conquest."
197409,video_games,In 7.00 they made it so you can't see the progress of the level of the enemy untill they are spotted.
1337140,sports,"&gt;So I ask, am I the only one who feels that way? 

Yes"
171496,video_games,"Lol EG is the most individually talented team in the world, all of their players have a legitimate argument for being #1 in their position in the world, and are AT worst, top 3."
2153774,news,"the articles does not give a full picture of what is happening on site. first the location of the melted fuel is unknown, they do not know how far the 90 tons (per core) of uranium burned into the ground. the site is still producing large amounts of contaminated water that is being stored on site. the total amount of fuel that is missing is some 1300 tons 3 cores and a holding pond all are missing and in the ground where ground water contact is occurring. the people who say there is no danger now are wrong. the clean up of the fuel which went beyond melting and was burning will not happen. the image shows residue that was caused by burning fuel. the best option will be to encase the site including under it. "
640918,video_games,"i have it, for owning the division."
18813,science_and_technology,[removed]
56031,sports,Sign me the fuck up! 
